{
  "$schema": "http://json-schema.org/draft-07/schema#",
  "$id": "https://a1engineer/schemas/team-config.json",
  "title": "Team Config",
  "description": "Schema for an A1 Engineer team configuration file.",
  "type": "object",
  "required": ["name", "repo", "agents"],
  "additionalProperties": false,
  "properties": {
    "$schema": {
      "type": "string",
      "description": "JSON Schema reference. Allowed so IDE tooling can include $schema in config files without failing validation."
    },
    "name": {
      "type": "string",
      "description": "Team name. Used as suffix for compose services: ergo-{name}, net-{name}, agent-{name}-{role}.",
      "pattern": "^[a-z][a-z0-9-]*$",
      "minLength": 2,
      "maxLength": 32
    },
    "repo": {
      "type": "object",
      "description": "Repository to clone into the team's git volume.",
      "required": ["url"],
      "additionalProperties": false,
      "properties": {
        "url": {
          "type": "string",
          "description": "Git remote URL (HTTPS or SSH).",
          "format": "uri"
        },
        "branch": {
          "type": "string",
          "description": "Branch to check out. Defaults to 'main'.",
          "default": "main"
        }
      }
    },
    "auth": {
      "type": "object",
      "description": "Authentication mode for Claude Code agents. Defaults to session auth.",
      "additionalProperties": false,
      "properties": {
        "mode": {
          "type": "string",
          "enum": ["session", "api-key"],
          "default": "session"
        },
        "sessionPath": {
          "type": "string",
          "description": "Path to Claude session directory. ~ is expanded to home dir.",
          "default": "~/.claude"
        },
        "apiKey": {
          "type": "string",
          "description": "Anthropic API key (only for api-key mode). Written to Docker secret at runtime, never stored."
        }
      }
    },
    "agents": {
      "type": "array",
      "description": "Agent definitions for this team.",
      "minItems": 1,
      "items": {
        "type": "object",
        "required": ["role", "model"],
        "additionalProperties": false,
        "properties": {
          "role": {
            "type": "string",
            "description": "Agent role. Maps to IRC_ROLE env var. Nick derived at runtime as {name}-{role} (with suffix for duplicates).",
            "enum": ["arch", "lead", "dev", "qa", "critic", "chuck"]
          },
          "model": {
            "type": "string",
            "description": "Claude model to use. Passed as CLAUDE_MODEL env var.",
            "enum": ["opus", "sonnet", "haiku"]
          },
          "effort": {
            "type": "string",
            "description": "Thinking effort level. TODO: wire through as CLAUDE_EFFORT env var once Claude Code consumption is confirmed.",
            "enum": ["high", "medium", "low"]
          },
          "runtime": {
            "type": "string",
            "description": "Agent runtime. Defaults to 'claude-code'.",
            "enum": ["claude-code", "codex", "custom"],
            "default": "claude-code"
          },
          "prompt": {
            "type": "string",
            "description": "Initial prompt for the agent. If omitted, falls back to .context/agents/{role}/prompt.md in the repo."
          },
          "auth": {
            "type": "string",
            "description": "Per-agent auth override. 'session' uses host OAuth tokens (~/.claude mount), 'api-key' uses ANTHROPIC_API_KEY from Docker secret. Defaults to team-level auth.mode.",
            "enum": ["session", "api-key"]
          },
          "env": {
            "type": "object",
            "description": "Extra environment variables injected into this agent's container. Values are coerced to strings.",
            "additionalProperties": {
              "type": ["string", "number", "boolean"]
            }
          }
        }
      }
    },
    "github": {
      "type": "object",
      "description": "GitHub App credentials for scoped repo access. If omitted, falls back to GITHUB_TOKEN env var (PAT mode).",
      "additionalProperties": false,
      "properties": {
        "appId": {
          "type": ["string", "integer"],
          "description": "GitHub App ID (numeric). Can also be set via GITHUB_APP_ID env var."
        },
        "installationId": {
          "type": ["string", "integer"],
          "description": "GitHub App Installation ID for the target repo/org. Can also be set via GITHUB_INSTALLATION_ID env var."
        },
        "privateKeyPath": {
          "type": "string",
          "description": "Path to the GitHub App private key PEM file. Can also be set via GITHUB_APP_PRIVATE_KEY_PATH env var."
        }
      }
    },
    "autoNudge": {
      "type": "object",
      "description": "Automatic nudge settings. When enabled, the Manager nudges idle agents based on heartbeat staleness. Disable if using a chuck orchestrator agent for intelligent nudging instead.",
      "additionalProperties": false,
      "properties": {
        "enabled": {
          "type": "boolean",
          "description": "Enable automatic nudging of idle agents. Defaults to true. Set to false when a chuck orchestrator agent handles nudging.",
          "default": true
        },
        "idleThresholdSeconds": {
          "type": "integer",
          "description": "Seconds of no heartbeat before an agent is considered idle and nudged. Defaults to 300 (5 min).",
          "default": 300,
          "minimum": 30
        },
        "nudgeMessage": {
          "type": "string",
          "description": "Message sent to idle agents via tmux send-keys.",
          "default": "continue. check IRC with msg read, then resume your current task."
        }
      }
    },
    "statusBroadcast": {
      "type": "object",
      "description": "Periodic @all status broadcast settings. Every intervalSeconds the manager posts \"@all statuses | Team: {name} | Agents: {roster}\" to the broadcast channel so all agents have current team context in their IRC log.",
      "additionalProperties": false,
      "properties": {
        "enabled": {
          "type": "boolean",
          "description": "Enable status broadcasts for this team. Defaults to true. Set to false to silence broadcasts.",
          "default": true
        },
        "channel": {
          "type": "string",
          "description": "IRC channel to post the status broadcast into. Defaults to '#main'.",
          "pattern": "^#[a-z][a-z0-9-]*$",
          "default": "#main"
        },
        "intervalSeconds": {
          "type": "integer",
          "description": "Broadcast interval in seconds. Stored for future per-team interval support; the global interval is set at Manager startup. Defaults to 300 (5 min).",
          "default": 300,
          "minimum": 60
        }
      }
    },
    "channels": {
      "type": "array",
      "items": { "type": "string", "pattern": "^#[a-z][a-z0-9-]*$" },
      "minItems": 1,
      "uniqueItems": true,
      "default": ["#main", "#tasks", "#code", "#testing", "#merges"],
      "description": "IRC channels for agents to join. Defaults to the 5 standard channels."
    },
    "ergo": {
      "type": "object",
      "description": "Optional Ergo IRC server configuration. Defaults are sufficient for local dev.",
      "additionalProperties": false,
      "properties": {
        "image": {
          "type": "string",
          "description": "Docker image for the Ergo IRC server.",
          "default": "a1-ergo:latest"
        },
        "configPath": {
          "type": "string",
          "description": "Host path to ircd.yaml to bind-mount into the container.",
          "default": "./templates/ergo/ircd.yaml"
        },
        "port": {
          "type": "integer",
          "description": "IRC port exposed on the internal Docker network.",
          "default": 6667
        },
        "hostPort": {
          "type": "integer",
          "description": "Host port to expose for direct IRC client access (e.g., Halloy). If set, Ergo is reachable at localhost:<hostPort>. Omit to keep IRC internal-only.",
          "minimum": 1024,
          "maximum": 65535
        }
      }
    }
  }
}
