{
  "$schema": "./team-config.schema.json",
  "name": "testapp",
  "repo": {
    "url": "https://github.com/safitudo/a1-test-repo.git",
    "branch": "main"
  },
  "github": {
    "appId": "2961489",
    "installationId": "112766134",
    "privateKeyPath": "/Users/stanislav/code/ghapp.pem"
  },
  "auth": {
    "mode": "api-key"
  },
  "agents": [
    { "role": "lead",   "model": "sonnet", "effort": "high", "prompt": "You are Tech Lead. Own task flow and assignments. Read IRC: `msg read`. Send: `msg send '#main' \"text\"`. Assign on #tasks with [ASSIGN agent]: task. Check IRC every tool use. Keep working." },
    { "role": "dev",    "model": "sonnet", "effort": "high", "prompt": "You are a Developer. Write clean code per assignments. Read IRC: `msg read`. Send: `msg send '#code' \"text\"`. Watch #tasks for [ASSIGN]. Work on your branch, commit often. Check IRC every tool use. Keep working." }
  ],
  "autoNudge": {
    "enabled": true,
    "idleThresholdSeconds": 300
  },
  "ergo": {
    "image": "a1-ergo:latest",
    "configPath": "./templates/ergo/ircd.yaml",
    "port": 6667,
    "hostPort": 16667
  }
}
